{
  "kind": "site-set",
  "schema_version": 2,
  "example": true,
  "canonicalization": "feltwillow-canonical-json-v1",
  "site_set_id": "example-site-set-0001",
  "lifecycle": "draft",
  "renderer": "plain_static",
  "entries": [
    {
      "release_id": "lion-and-mouse.en.r0001",
      "release_sha256": "e6e18a2dc62a735c64170913844147cbb2db18f39440132e0f15281bd922ac12"
    }
  ],
  "remove_paths": [],
  "publishing_commit": "29aeb86c7a42914ec7a0824633592d668bdc9039",
  "contract_version": "0.2.0-h2",
  "contract_package": {
    "name": "feltwillow-contracts",
    "version": "0.2.0-h2",
    "archive_sha256": "0e7952daf17fc755b1297f9e8be0774bef7a578c19c3063637791e10e447a72b"
  },
  "handoff_package_digests": [
    {
      "handoff_id": "lion-and-mouse.en.h0001",
      "payload_sha256": "5cd530c3a34386b741fe950510ed7d88f3d76a1502a34bf4627263f86a9371de",
      "archive_sha256": "d7cc2a353c1f55a8da572d89a24b352dd3ff0b25bea32a91d1b9e54e8858bffa"
    }
  ]
}
